{
  "schemaVersion": 1,
  "version": "1.2.0",
  "runtime": "codex-docker",
  "id": "video-build",
  "title": "文字驱动视频制作",
  "description": "素材准备与对齐、剪辑、精修；提供固定版本 video-use、脚本素材适配器、FFmpeg 和中文字体。TTS/图片生成/视频生成由 Video App MCP 服务提供。",
  "searchBackends": [
    "none"
  ],
  "defaultSearchBackend": "none",
  "aptPackages": [
    "ffmpeg",
    "fonts-noto-cjk",
    "fontconfig"
  ],
  "pythonPackages": [
    "Pillow"
  ],
  "skill": "build-video-artifacts",
  "tools": [
    "Python 3",
    "Node.js",
    "Git",
    "curl",
    "ripgrep",
    "FFmpeg",
    "ffprobe",
    "Pillow",
    "Noto CJK",
    "video-use 0.1.0",
    "script-media adapter"
  ],
  "outputs": [
    "completion.json",
    "final.mp4",
    "edl.json",
    "validation.json"
  ],
  "resources": {
    "cpus": 4,
    "memoryMB": 4096,
    "network": "bridge"
  },
  "optionalComponents": []
}
